{"aiRuns":[{"externalApiUsed":true,"externalDisclosureManifestSha256":"e78fb4aecba6cd664bf299a868faf46386bf6355adfc1e832c5581d09cd2a229","externalDisclosureModeSummary":"exact","externalDisclosurePolicyId":"article-external-ai-disclosure-v1","externalDisclosurePolicySha256":"2030471f1f9de6bd226ddbdffdc0270edb07849b9ba93fbf180fe470e0a0f660","model":"gpt-6.1-sol","provider":"openai","requestSha256":"b71dd63f1ed1ac2105d1b5cfdc935d3658ed1f54e532c97113b25d389c2a33d5","responseSha256":"6098c0a318bd172e1a3f1ac169c8ac19a209b49ae0772cf09011e121be08fa8c","role":"auditor","skillId":"independent-article-audit","skillSha256":"54f5a23f71e39878fa02c554f9ff7b32981f79cda4718b7dd05235cbcfb60a7c"},{"externalApiUsed":true,"externalDisclosureManifestSha256":"7ab2530d22b6e608fcbd44ffa7e37efaf2d09faeb7a9a3613b3f0cb51b745add","externalDisclosureModeSummary":"exact","externalDisclosurePolicyId":"article-external-ai-disclosure-v1","externalDisclosurePolicySha256":"2030471f1f9de6bd226ddbdffdc0270edb07849b9ba93fbf180fe470e0a0f660","model":"gpt-6.1-sol","provider":"openai","requestSha256":"7b9e15bd161304e8d4bf0a7e89237d4d059614c3f10dbea8c0be8c8a9b1ac3cf","responseSha256":"b32d5e8bf51c411aff70152b598891a112fb365fb0dac40e6521f38b2d820837","role":"visual_auditor","skillId":"independent-visual-audit","skillSha256":"2898ac28761e87425721e585bf1c506cd030aa44f15ac80481b564c9c8277245"}],"articleJob":{"approvalRecordSha256":"a29fe70e4709123f971b4f58b868a1ec3507f71eb44c7e834ed3519810064621","candidateSha256":"775d44dac2e6de72359babfb35ace9af7bc3ceaa3846646e6d7ca0298825ef79","canonicalSourceStorageReceiptSetSha256":"94d29530765bed58c06205b23623fc8f77d42281a4303ad0866ee15603c3defc","citationCompilationSha256":"35023b68c49bcf5eaf1d0e0c5075e993ba53196170125a864c91e92f890bb4d0","contentAuditSha256":"ac79b7cbb9715157c940bec430c0f858f1c6e3bf2869ca984ef65506650d16bf","evidenceBundleSha256":"a5fa286e7b70b0a635434776a2759f64e532900caea24bb8371f6d279b9419c4","externalAiPolicyId":"article-external-ai-disclosure-v1","externalAiPolicySha256":"2030471f1f9de6bd226ddbdffdc0270edb07849b9ba93fbf180fe470e0a0f660","jobId":"job-4b33a2bb-ea4b-4f72-a6ae-7e10c1bb3d77","mediaProtectionReceiptSha256":"649199760ddae2d57c804cadf4b110fc07c7bc3393bb758f72ec1edfa787c279","mediaPublicationManifestSha256":"03cbd7c95d0099969dad4780764c99f1f5c6e0b768f87da790e80f6bc0e341ca","sourceBundleSha256":"2cbf644b050869be537cd8c939c71e39ea706c8dbc0b0202c751b7366405e0cc","technicalExampleVerificationSha256":"4f53cda18c2baa0c0354bb5f9a3ecbe5ed12ab4d8e11ba873c2f11161202b945","visualAuditSha256":"b987c30e0497fc41fc33f1f168a18c497f97704b799d3d50e7eb1924923dcfca"},"content":{"frontmatterSha256":"a90c527a056d552e13bd01e460a7870cb16ad58b134e3dfe46a3e312985a4359","mdxSha256":"cd8165b303f36b6d415c3b2f39e5473b903cb2f9707146286e06034a74969f76","route":"/articles/77arj41r5z8amrn46pdx71mknr/"},"contentId":"e7562440-e0bf-42a9-8a90-d66f4e1a4eb8","exportedAt":"2026-11-02T01:18:46.708Z","materialClaims":[{"claimId":"c0001","claimType":"recommendation","evidence":[{"evidenceId":"e0002","freshnessChecked":true,"interpretation":"explicit","propositionSha256":"ba913169bcfb054eb5e6ef41bbcbc5f1b592571beec8a89ed8acfd56fc513335","propositionSummary":"充填率100%が近道とは限りません。","sourceIds":["s0001","s0002"]},{"evidenceId":"e0016","freshnessChecked":true,"interpretation":"recommendation_basis","propositionSha256":"437006ebf4a2718f359595b55edba7af40ffd3a3bd653d9f8cf049eace3d6494","propositionSummary":"充填率100%が近道とは限りません。","sourceIds":["s0003","s0023","s0024"]},{"evidenceId":"e0017","freshnessChecked":true,"interpretation":"recommendation_basis","propositionSha256":"f575acb1a13e428a6e3f6a5669bed6d86ec67388c9aa5891d9c896b49d7647b2","propositionSummary":"充填率100%が近道とは限りません。","sourceIds":["s0001","s0002","s0003","s0009"]}],"locator":{"blockIndex":1},"statementSha256":"f610a76a2444943c7b3bf4040369df5c14fe8d95a643c5a8ad89384f551e8a6b"},{"claimId":"c0002","claimType":"recommendation","evidence":[{"evidenceId":"e0016","freshnessChecked":true,"interpretation":"recommendation_basis","propositionSha256":"437006ebf4a2718f359595b55edba7af40ffd3a3bd653d9f8cf049eace3d6494","propositionSummary":"たとえば層の境目で割れたフックなら、中身を詰める前に印刷する向きを見ます。","sourceIds":["s0003","s0023","s0024"]}],"locator":{"blockIndex":1},"statementSha256":"2c8e1c871a65969afd43d7fa6fbf09afdf5d1f6026a4bb1455ed53f5bfe66397"},{"claimId":"c0003","claimType":"limitation","evidence":[{"evidenceId":"e0005","freshnessChecked":true,"interpretation":"explicit","propositionSha256":"de7901f27bf78bceb22dc34b11176880a7c3dc9fdb682fec87c178d97131f445","propositionSummary":"ここでは、溶かした樹脂を一層ずつ重ねる方式（FDM／FFF）の小物を扱います。","sourceIds":["s0003"]}],"locator":{"blockIndex":3},"statementSha256":"c4e9b64b8c6f8f3cac342715d7e8fa5fc85008b8b529ee086cc526f546bbc958"},{"claimId":"c0004","claimType":"recommendation","evidence":[{"evidenceId":"e0016","freshnessChecked":true,"interpretation":"recommendation_basis","propositionSha256":"437006ebf4a2718f359595b55edba7af40ffd3a3bd653d9f8cf049eace3d6494","propositionSummary":"**横筋に沿って割れたフック**：層の境目と、使用時に引っ張られる向きを見ます。","sourceIds":["s0003","s0023","s0024"]}],"locator":{"blockIndex":4},"statementSha256":"4388267ddfb2ea6e6491e8ea693dc8d0bff24afeb5ca5a83f27f1bfb59aa6d43"},{"claimId":"c0005","claimType":"recommendation","evidence":[{"evidenceId":"e0017","freshnessChecked":true,"interpretation":"recommendation_basis","propositionSha256":"f575acb1a13e428a6e3f6a5669bed6d86ec67388c9aa5891d9c896b49d7647b2","propositionSummary":"**層をまたいで根元が折れたフック**：根元の太さや角の形、外周の厚さを見ます。","sourceIds":["s0001","s0002","s0003","s0009"]}],"locator":{"blockIndex":4},"statementSha256":"78b40346455819acc1402607712dcf4b9db827fe9f024b4ab0c653e8237f3127"},{"claimId":"c0006","claimType":"recommendation","evidence":[{"evidenceId":"e0017","freshnessChecked":true,"interpretation":"recommendation_basis","propositionSha256":"f575acb1a13e428a6e3f6a5669bed6d86ec67388c9aa5891d9c896b49d7647b2","propositionSummary":"**上面だけがへこむケース**：上面の厚さと、その下にある支えの間隔を見ます。","sourceIds":["s0001","s0002","s0003","s0009"]}],"locator":{"blockIndex":4},"statementSha256":"07536ee059db13f18cef5ff1c4420e41182b69eb1cd2b579be66cf539d48e312"},{"claimId":"c0007","claimType":"source_fact","evidence":[{"evidenceId":"e0001","freshnessChecked":true,"interpretation":"explicit","propositionSha256":"c647da8293a0c236c4d5eba58122d568e5d1b41280297f4ea1436ec7e85018f9","propositionSummary":"外周は部品の輪郭に沿った壁、インフィルはその内側の充填構造です。","sourceIds":["s0002","s0004","s0006"]}],"locator":{"blockIndex":5},"statementSha256":"0e6c37233bd384546776ec24c7489e307da9e6989aee44d61cdd20419106bb28"},{"claimId":"c0008","claimType":"source_fact","evidence":[{"evidenceId":"e0001","freshnessChecked":true,"interpretation":"explicit","propositionSha256":"c647da8293a0c236c4d5eba58122d568e5d1b41280297f4ea1436ec7e85018f9","propositionSummary":"印刷データを作るソフト「スライサー」では、外周の本数とインフィルの密度を別々に設定できます。","sourceIds":["s0002","s0004","s0006"]}],"locator":{"blockIndex":5},"statementSha256":"45097d7c5ae15f7503692dcde4280a537d0b3eeddbf1a1c513785f4350d560ec"},{"claimId":"c0009","claimType":"limitation","evidence":[{"evidenceId":"e0014","freshnessChecked":true,"interpretation":"direct_observation","propositionSha256":"a6072faf88d6e8e810ea0b8f6a2647960de083cc52fd16e17ceb5d1efbb8bf59","propositionSummary":"下のAを基準に、Bは外周2→4周、Cは充填率15→30%としています。","sourceIds":["s0020","s0021","s0022"]}],"locator":{"blockIndex":7},"statementSha256":"e4d4866a1fdf60d4fd8d190d9654b5891a9fe5a67f6c11439f1fa3b5598da989"},{"claimId":"c0010","claimType":"recommendation","evidence":[{"evidenceId":"e0014","freshnessChecked":true,"interpretation":"direct_observation","propositionSha256":"a6072faf88d6e8e810ea0b8f6a2647960de083cc52fd16e17ceb5d1efbb8bf59","propositionSummary":"Bでは壁が内側へ厚くなり、Cでは内部の支えの間隔が狭くなります。","sourceIds":["s0020","s0021","s0022"]},{"evidenceId":"e0004","freshnessChecked":true,"interpretation":"explicit","propositionSha256":"c98686d1e0188b2ced22c245651be92dcfc8836cb501c6e12d0ef72b0a59acfd","propositionSummary":"Bでは壁が内側へ厚くなり、Cでは内部の支えの間隔が狭くなります。","sourceIds":["s0008"]}],"locator":{"blockIndex":9},"statementSha256":"c53e6aa96e96f02de4f7f6a83f65a6bde369478688ea116fdb75bf2993a4bc76"},{"claimId":"c0011","claimType":"source_fact","evidence":[{"evidenceId":"e0014","freshnessChecked":true,"interpretation":"direct_observation","propositionSha256":"a6072faf88d6e8e810ea0b8f6a2647960de083cc52fd16e17ceb5d1efbb8bf59","propositionSummary":"外から見える形は同じでも、材料を足す場所が違います。","sourceIds":["s0020","s0021","s0022"]}],"locator":{"blockIndex":9},"statementSha256":"faf96e4f7e8aba00fcc38dbee4cc23a81f32785fbea2c7126a5df95cd920901c"},{"claimId":"c0012","claimType":"recommendation","evidence":[{"evidenceId":"e0023","freshnessChecked":true,"interpretation":"explicit","propositionSha256":"22099a607e3c355d742b27fec679f5446a2fc0ea7e1add614a0855472198dd49","propositionSummary":"スライス後のプレビューで表示する層を途中まで下げると、この断面を確認できます。","sourceIds":["s0014"]}],"locator":{"blockIndex":10},"statementSha256":"d01d1ce1e23b6e780728039c20b2d6ecfc3fb3f63ba5b01df2c7d05ab8ac1de4"},{"claimId":"c0013","claimType":"recommendation","evidence":[{"evidenceId":"e0002","freshnessChecked":true,"interpretation":"explicit","propositionSha256":"ba913169bcfb054eb5e6ef41bbcbc5f1b592571beec8a89ed8acfd56fc513335","propositionSummary":"外周数を増やすのは強度を見直す代表的な方法ですが、層に沿った割れなら、次の向きの比較へ進みます。","sourceIds":["s0001","s0002"]},{"evidenceId":"e0016","freshnessChecked":true,"interpretation":"recommendation_basis","propositionSha256":"437006ebf4a2718f359595b55edba7af40ffd3a3bd653d9f8cf049eace3d6494","propositionSummary":"外周数を増やすのは強度を見直す代表的な方法ですが、層に沿った割れなら、次の向きの比較へ進みます。","sourceIds":["s0003","s0023","s0024"]}],"locator":{"blockIndex":10},"statementSha256":"f1496d53a4907f956d6f4926f762f579d0f5bec78d891909976a2f58063e46a2"},{"claimId":"c0014","claimType":"source_fact","evidence":[{"evidenceId":"e0001","freshnessChecked":true,"interpretation":"explicit","propositionSha256":"c647da8293a0c236c4d5eba58122d568e5d1b41280297f4ea1436ec7e85018f9","propositionSummary":"外周を増やすと、輪郭に沿って材料を並べる範囲が広がります。","sourceIds":["s0002","s0004","s0006"]},{"evidenceId":"e001